Artist,Title,prepText,allText
Rev. James Cleveland,Child of the Most High King, contributoractes and monuments foxe’s book of martyrs chapter lyricspersecutions in england during the reign of queen marythe premature death of that celebrated young monarch edward vi occasioned the most extraordinary and wonderful occurrences which had ever existed from the times of our blessed lord and saviors incarnation in human shape this melancholy event became speedily a subject of general regret the succession to the british throne was soon made a matter of contention and the scenes which ensued were a demonstration of the serious affliction in which the kingdom was involved as his loss to the nation was more and more unfolded the remembrance of his government was more and more the basis of grateful recollection the very awful prospect which was soon presented to the friends of edwards administration under the direction of his counsellors and servants was a contemplation which the reflecting mind was compelled to regard with most alarming apprehensions the rapid approaches which were made towards a total reversion of the proceedings of the young kings reign denoted the advances which were thereby represented to an entire resolution in the management of public affairs both in church and state alarmed for the condition in which the kingdom was likely to be involved by the kings death an endeavor to prevent the consequences which were but too plainly foreseen was productive of the most serious and fatal effects the king in his long and lingering affliction was induced to make a will by which he bequeathed the english crown to lady jane the daughter of the duke of suffolk who had been married to lord guilford the son of the duke of northumberland and was the granddaughter of the second sister of king henry by charles duke of suffolk by this will the succession of mary and elizabeth his two sisters was entirely superseded from an apprehension of the returning system of popery and the kings council with the chief of the nobility the lordmayor of the city of london and almost all the judges and the principal lawyers of the realm subscribed their names to this regulation as a sanction to the measure lord chief justice hale though a true protestant and an upright judge alone declined to unite his name in favor of the lady jane because he had already signified his opinion that mary was entitled to assume the reins of government others objected to marys being placed on the throne on account of their fears that she might marry a foreigner and thereby bring the crown into considerable danger her partiality to popery also left little doubt on the minds of any that she would be induced to revive the dormant interests of the pope and change the religion which had been used both in the days of her father king henry and in those of her brother edward for in all his time she had manifested the greatest stubbornness and inflexibility of temper as must be obvious from her letter to the lords of the council whereby she put in her claim to the crown on her brothers decease,Rev. James Cleveland Child of the Most High King  contributoractes and monuments foxe’s book of martyrs chapter lyricspersecutions in england during the reign of queen marythe premature death of that celebrated young monarch edward vi occasioned the most extraordinary and wonderful occurrences which had ever existed from the times of our blessed lord and saviors incarnation in human shape this melancholy event became speedily a subject of general regret the succession to the british throne was soon made a matter of contention and the scenes which ensued were a demonstration of the serious affliction in which the kingdom was involved as his loss to the nation was more and more unfolded the remembrance of his government was more and more the basis of grateful recollection the very awful prospect which was soon presented to the friends of edwards administration under the direction of his counsellors and servants was a contemplation which the reflecting mind was compelled to regard with most alarming apprehensions the rapid approaches which were made towards a total reversion of the proceedings of the young kings reign denoted the advances which were thereby represented to an entire resolution in the management of public affairs both in church and state alarmed for the condition in which the kingdom was likely to be involved by the kings death an endeavor to prevent the consequences which were but too plainly foreseen was productive of the most serious and fatal effects the king in his long and lingering affliction was induced to make a will by which he bequeathed the english crown to lady jane the daughter of the duke of suffolk who had been married to lord guilford the son of the duke of northumberland and was the granddaughter of the second sister of king henry by charles duke of suffolk by this will the succession of mary and elizabeth his two sisters was entirely superseded from an apprehension of the returning system of popery and the kings council with the chief of the nobility the lordmayor of the city of london and almost all the judges and the principal lawyers of the realm subscribed their names to this regulation as a sanction to the measure lord chief justice hale though a true protestant and an upright judge alone declined to unite his name in favor of the lady jane because he had already signified his opinion that mary was entitled to assume the reins of government others objected to marys being placed on the throne on account of their fears that she might marry a foreigner and thereby bring the crown into considerable danger her partiality to popery also left little doubt on the minds of any that she would be induced to revive the dormant interests of the pope and change the religion which had been used both in the days of her father king henry and in those of her brother edward for in all his time she had manifested the greatest stubbornness and inflexibility of temper as must be obvious from her letter to the lords of the council whereby she put in her claim to the crown on her brothers decease
Daryl Coley,That Special Place, contributorschapter surprises lyricshelen keller had said in we vote what does that mean and emma goldman around the same time our modern fetish is universal suffrage after women were voting as men did and their subordinate condition had hardly changed right after women got the vote the measure of their social progress can he seen in an advice column written by dorothy dix that appeared in newspapers all over the country the woman should not merely be a domestic drudge she said,Daryl Coley That Special Place  contributorschapter surprises lyricshelen keller had said in we vote what does that mean and emma goldman around the same time our modern fetish is universal suffrage after women were voting as men did and their subordinate condition had hardly changed right after women got the vote the measure of their social progress can he seen in an advice column written by dorothy dix that appeared in newspapers all over the country the woman should not merely be a domestic drudge she said
Tech N9ne,The Beast, contributorsthe beast lyricsintro krizz kaliko insanity at its finest fire starter,Tech N9ne The Beast  contributorsthe beast lyricsintro krizz kaliko insanity at its finest fire starter
Bad Meets Evil,Above The Law,paroles de la chanson above the law par bad meets evil claret jai sometimes life seems so unfortunate thats why i dont give a shit,Bad Meets Evil Above The Law paroles de la chanson above the law par bad meets evil claret jai sometimes life seems so unfortunate thats why i dont give a shit
Disclosure,Latch,paroles de la chanson latch par disclosure you left my heart out when the rest of me is down,Disclosure Latch paroles de la chanson latch par disclosure you left my heart out when the rest of me is down
BTS,Dope, contributorstranslationsfrançaisromanizationenglish쩔어 dope lyrics방탄소년단 쩔어 dope 가사 intro rm,BTS Dope  contributorstranslationsfrançaisromanizationenglish쩔어 dope lyrics방탄소년단 쩔어 dope 가사 intro rm
BTS,I Need U, contributorstranslationsукраїнськаespañolहिन्दीfrançaisenglishchinese traditionalromanizationi need u lyrics방탄소년단 i need u 가사 intro jung kook rm,BTS I Need U  contributorstranslationsукраїнськаespañolहिन्दीfrançaisenglishchinese traditionalromanizationi need u lyrics방탄소년단 i need u 가사 intro jung kook rm
SISTAR,I Like That, contributorstranslationsromanizationi like that lyrics씨스타 i like that 가사 intro hyolyn,SISTAR I Like That  contributorstranslationsromanizationi like that lyrics씨스타 i like that 가사 intro hyolyn
SISTAR,Say I Love You, contributorstranslationsromanizationsay i love you lyrics씨스타 say i love you 가사 intro hyolyn,SISTAR Say I Love You  contributorstranslationsromanizationsay i love you lyrics씨스타 say i love you 가사 intro hyolyn
Yu Jae Seok,Dancing King, contributor2018 haywoodindahood listening log lyricslast updated 516pm mstoctoberoctober 6jesse powell — jesse powell 1996october 5girl in red — chapter blanca — shattered lougotcash feat trippie redd — too turnt 2018october 4terri clark — raising the bar ,Yu Jae Seok Dancing King  contributor2018 haywoodindahood listening log lyricslast updated 516pm mstoctoberoctober 6jesse powell — jesse powell 1996october 5girl in red — chapter blanca — shattered lougotcash feat trippie redd — too turnt 2018october 4terri clark — raising the bar 
Kris Kristofferson,The Silver Tongued Devil and I, contributorsthe silver tongued devil and i lyricsi took myself down to the tally ho tavern to buy me a bottle of beer and i sat me down by a tender young maiden,Kris Kristofferson The Silver Tongued Devil and I  contributorsthe silver tongued devil and i lyricsi took myself down to the tally ho tavern to buy me a bottle of beer and i sat me down by a tender young maiden
John Hiatt,Have A Little Faith In Me, contributorshave a little faith in me lyricsverse when the road gets dark and you can no longer see,John Hiatt Have A Little Faith In Me  contributorshave a little faith in me lyricsverse when the road gets dark and you can no longer see
John Prine,That's The Way The World Goes Round, contributorsthat’s the way that the world goes ’round lyricsi know a guy thats got a lot to lose hes a pretty nice fellow but kind of confused hes got muscles in his head that aint never been used,John Prine That's The Way The World Goes Round  contributorsthat’s the way that the world goes ’round lyricsi know a guy thats got a lot to lose hes a pretty nice fellow but kind of confused hes got muscles in his head that aint never been used
Tom Petty,I Won't Back Down, contributorsi won’t back down lyricsverse well i wont back down no i wont back down,Tom Petty I Won't Back Down  contributorsi won’t back down lyricsverse well i wont back down no i wont back down
Lukas Graham,7 Years,paroles de la chanson years par lukas graham once i was seven years old my momma told me go make yourself some friends or youll be lonely,Lukas Graham 7 Years paroles de la chanson years par lukas graham once i was seven years old my momma told me go make yourself some friends or youll be lonely
ZAYN,fOoL fOr YoU, contributorstranslationsespañol​fool for you lyricsverse this love is tainted i need you and i hate it,ZAYN fOoL fOr YoU  contributorstranslationsespañol​fool for you lyricsverse this love is tainted i need you and i hate it
Tori Kelly,I Was Made For Loving You,paroles de la chanson i was made for loving you par tori kelly im the rush of a bleeding heart im the bruise of a rough start,Tori Kelly I Was Made For Loving You paroles de la chanson i was made for loving you par tori kelly im the rush of a bleeding heart im the bruise of a rough start
Gareth Quinn Redmond - Céim*eanna,Johnny Climax - I'm Fine, brian crosby in our own words original score ellll febreeze blue loser fanclub … loading john mcglynn fragments,Gareth Quinn Redmond - Céim*eanna Johnny Climax - I'm Fine  brian crosby in our own words original score ellll febreeze blue loser fanclub … loading john mcglynn fragments
Voces8 - Enchanted Isle 1/17,Danny Burns - North Country, the brad pitt light orchestra songs from the unlucky cabin boy original limerick cast mosmo strange dingus ep daveit ferris dizzy waltz cable boy whole,Voces8 - Enchanted Isle 1/17 Danny Burns - North Country  the brad pitt light orchestra songs from the unlucky cabin boy original limerick cast mosmo strange dingus ep daveit ferris dizzy waltz cable boy whole
Bouts - Flow 2/9,Wild Youth - The Last Goodbye, emr health micheal oshea michael o’shea blue niall blue summer ep 36february12 zaska it takes a village jealous of the birds wisdom teeth,Bouts - Flow 2/9 Wild Youth - The Last Goodbye  emr health micheal oshea michael o’shea blue niall blue summer ep 36february12 zaska it takes a village jealous of the birds wisdom teeth
John Blek - Thistle & Thorn,Niall Horan - Flicker Featuring The RTÉ Concert Orchestra (Live), empire circus tí simm simma sounds pass the aux cord mikron severance bill shanley midnight mission,John Blek - Thistle & Thorn Niall Horan - Flicker Featuring The RTÉ Concert Orchestra (Live)  empire circus tí simm simma sounds pass the aux cord mikron severance bill shanley midnight mission
Talos - Far Out Dust,Postcard Versions - Postcard Versions, not earth no shit 79cortinaz evo looting smokey live from somewhere regret will come regret will come,Talos - Far Out Dust Postcard Versions - Postcard Versions  not earth no shit 79cortinaz evo looting smokey live from somewhere regret will come regret will come
HALVES - Old Haunts (Rarities 2007-2014) 2/11,Sunken Foal - Ribbon Works Vol​.​1 E​P, peco the middle ages post punk podge the technohippies post millennium tension daoiri farrell a lifetime of happiness löwli feathers,HALVES - Old Haunts (Rarities 2007-2014) 2/11 Sunken Foal - Ribbon Works Vol​.​1 E​P  peco the middle ages post punk podge the technohippies post millennium tension daoiri farrell a lifetime of happiness löwli feathers
Host - Adolescent Content,Paul Gilgunn - Here We Are Now, rachael boyd weave a band called paul primero the gloaming the gloaming ellll confectionary,Host - Adolescent Content Paul Gilgunn - Here We Are Now  rachael boyd weave a band called paul primero the gloaming the gloaming ellll confectionary
Casavettes - Senselessness,Nouveaunoise - (◉﹏◉), the receipts the receiptsmarch13 hozier wasteland baby sheerbuzz all our time and money innik the hare and the line maria somerville all my people ,Casavettes - Senselessness Nouveaunoise - (◉﹏◉)  the receipts the receiptsmarch13 hozier wasteland baby sheerbuzz all our time and money innik the hare and the line maria somerville all my people 
Other Creatures - COKO,New Jackson - Romancecar Ep, awkward z whats next caroline reel the waters of life dave clarke listen for the signals james joys a constellation of bargained parts,Other Creatures - COKO New Jackson - Romancecar Ep  awkward z whats next caroline reel the waters of life dave clarke listen for the signals james joys a constellation of bargained parts
Son of the Hound - Cheers. Sound. Good Luck.,Saoirse Casey - Lunaria, hudson taylor hudson taylor on audiotree live space dimension controller redemption of the cryonauts kevi knight wildcard paul tiernan the invisible man,Son of the Hound - Cheers. Sound. Good Luck. Saoirse Casey - Lunaria  hudson taylor hudson taylor on audiotree live space dimension controller redemption of the cryonauts kevi knight wildcard paul tiernan the invisible man
Jafaris - Stride 7/13,Jack O'Rourke - Ivory Towers, moving still with oud damien dempsey union new jackson the night mail the ronan gallagher band always broke never broken,Jafaris - Stride 7/13 Jack O'Rourke - Ivory Towers  moving still with oud damien dempsey union new jackson the night mail the ronan gallagher band always broke never broken
Conor Walsh - The Lucid,Late Night Pharmacy - Flamingo, powpig junior brother powpigjunior brother amateur pharmacy amateur pharmacy lakker época jester shadows need a light,Conor Walsh - The Lucid Late Night Pharmacy - Flamingo  powpig junior brother powpigjunior brother amateur pharmacy amateur pharmacy lakker época jester shadows need a light
Double Screen - Vienna Vienna,His Father's Voice - Context and Perspective, nova electric waves ep gilbert or the unfathomable loneliness of the deep space prospector west of space shane kelly lester the attic arms that fit like legs legwork,Double Screen - Vienna Vienna His Father's Voice - Context and Perspective  nova electric waves ep gilbert or the unfathomable loneliness of the deep space prospector west of space shane kelly lester the attic arms that fit like legs legwork
Hannah  Peel & Will Burns - Chalk Hill Blue,Rushes - Glimpse 1/5, nilüfer yanya miss universe maverick sabre when i wake up damian mcginty young forever andrew simon macallister ikiryo,Hannah  Peel & Will Burns - Chalk Hill Blue Rushes - Glimpse 1/5  nilüfer yanya miss universe maverick sabre when i wake up damian mcginty young forever andrew simon macallister ikiryo
Jeorge II - The Descent 0/5,The Pelms - HBO Comedy Special, ross o halloran rebirth deaf joe love stories the scratch the whole buzz laoise mad ep,Jeorge II - The Descent 0/5 The Pelms - HBO Comedy Special  ross o halloran rebirth deaf joe love stories the scratch the whole buzz laoise mad ep
Ye Vagabonds - Ye Vagabonds 0/3,Kettama - Eastside Avenue, cada diotran32 son of the hound cheers sound good luck munky un deux trois cat stone blind state alive,Ye Vagabonds - Ye Vagabonds 0/3 Kettama - Eastside Avenue  cada diotran32 son of the hound cheers sound good luck munky un deux trois cat stone blind state alive
Sonja Sleator - Violent Strawberry,Daveit Ferris - Send The Rocketships, chasing abbey the odyssey project the lee harveys – resistance is not terrorism active youth oranges hey zeus,Sonja Sleator - Violent Strawberry Daveit Ferris - Send The Rocketships  chasing abbey the odyssey project the lee harveys – resistance is not terrorism active youth oranges hey zeus
Ciarán Moran - & I Haven't Even Started Yet,Gráinne & Brendan - Songs From Ireland, the shaker hymn the shape of the sea walking on cars colours fontaines dc dogrel glen hansard this wild willing,Ciarán Moran - & I Haven't Even Started Yet Gráinne & Brendan - Songs From Ireland  the shaker hymn the shape of the sea walking on cars colours fontaines dc dogrel glen hansard this wild willing
Lugosi Coven - Rise From The Grave,Fixity - No Man Can Tell, erica cody leoness rebekah fitch lies we tell ourselves blue americans sum yen all city records buntús rince explorations in irish jazz fusion folk ,Lugosi Coven - Rise From The Grave Fixity - No Man Can Tell  erica cody leoness rebekah fitch lies we tell ourselves blue americans sum yen all city records buntús rince explorations in irish jazz fusion folk 
Jamie Adam - Melodic Electronic,Rich Wilson - A Little Love, dowry other voices presents dowry bodies glue old hannah borealis stephen colfer pleasure craft,Jamie Adam - Melodic Electronic Rich Wilson - A Little Love  dowry other voices presents dowry bodies glue old hannah borealis stephen colfer pleasure craft
Gavin James - Always (Remix EP),Telephone Explosions - Telephone Explosions, uwmami nund ushmush oileáin m shutak the widows house anna mieke idle mind,Gavin James - Always (Remix EP) Telephone Explosions - Telephone Explosions  uwmami nund ushmush oileáin m shutak the widows house anna mieke idle mind
SOAK - Grim Town,The Man Whom - The Dancer From The Dance, ryan mack someone else ep chris haze chasing rivers ep eve clague young naive me cormac neeson white feather,SOAK - Grim Town The Man Whom - The Dancer From The Dance  ryan mack someone else ep chris haze chasing rivers ep eve clague young naive me cormac neeson white feather
WaGwan - Tunes to Pay Rent,Felonies - What Comes Next EP 2/7, collette sheerin watershed hoursmay15 kevin herm connolly make it up adam nolan street improv subtle hints daveit ferris painting monsters on the floorboards kubb panoramawait,WaGwan - Tunes to Pay Rent Felonies - What Comes Next EP 2/7  collette sheerin watershed hoursmay15 kevin herm connolly make it up adam nolan street improv subtle hints daveit ferris painting monsters on the floorboards kubb panoramawait
a lazarus soul - The D They Put Between the R & the L,Le Boom - All Of My Highs, valhalla big menthey fall embrace the crisis heal weavers creature ep gerry o’beirne swimming the horses,a lazarus soul - The D They Put Between the R & the L Le Boom - All Of My Highs  valhalla big menthey fall embrace the crisis heal weavers creature ep gerry o’beirne swimming the horses
Hey Rusty - Lady’s Lane EP,Lady Landscape - 2, department of forever unseen pictures queen bonobo light shadow boom boom comrade hat tuque citrus fresh early dayslate nights,Hey Rusty - Lady’s Lane EP Lady Landscape - 2  department of forever unseen pictures queen bonobo light shadow boom boom comrade hat tuque citrus fresh early dayslate nights
Branwen - Hunted and Haunted,Pinhead Reverie - Kill The Messenger EP, séamus barra ó súilleabháin ón mbarr aníos mitch macateer lost in the wild damien o’reilly dúchas mongoose suck the wound,Branwen - Hunted and Haunted Pinhead Reverie - Kill The Messenger EP  séamus barra ó súilleabháin ón mbarr aníos mitch macateer lost in the wild damien o’reilly dúchas mongoose suck the wound
In Their Thousands - Acrasia,Beauty Sleep - Be Kind, colm mac con iomaire the river holds its breath kitt philippa you shane richardson the bigger picture the vercettis starfish island,In Their Thousands - Acrasia Beauty Sleep - Be Kind  colm mac con iomaire the river holds its breath kitt philippa you shane richardson the bigger picture the vercettis starfish island
BITFLOWER - Mastalgia,Mementeau - Permanent Ghost, super extra bonus party some dark forces eric eckhart luminous whenyoung reasons to dream joshua burnside live at the elmwood hall ,BITFLOWER - Mastalgia Mementeau - Permanent Ghost  super extra bonus party some dark forces eric eckhart luminous whenyoung reasons to dream joshua burnside live at the elmwood hall 
The Pale - Merciful Hour,Junior Brother - Pull The Right Rope, thumper out of body automessage my tribe your tribe i learn a lot from you swimming tapes morningside gender chores womansplain,The Pale - Merciful Hour Junior Brother - Pull The Right Rope  thumper out of body automessage my tribe your tribe i learn a lot from you swimming tapes morningside gender chores womansplain
Dislocated Love - Beauty of Heights,Brave Giant - Hymns For The Working Man, dislocated love patron saint of city lights lisa hannigan stargaze live in dublin bairbre anne i wanted to do it right but theres no such thing tomorrows the night chorus pt ,Dislocated Love - Beauty of Heights Brave Giant - Hymns For The Working Man  dislocated love patron saint of city lights lisa hannigan stargaze live in dublin bairbre anne i wanted to do it right but theres no such thing tomorrows the night chorus pt 
Runabay - Between The Lines,RikShaw - Junk Food 0/6, jonny dillon songs for a onestring guitarjune16 daveit ferris electricity for hummingbirds daveit ferris you blossom as i wilt john mcgrath wake and whisper eurelle dark chromatic,Runabay - Between The Lines RikShaw - Junk Food 0/6  jonny dillon songs for a onestring guitarjune16 daveit ferris electricity for hummingbirds daveit ferris you blossom as i wilt john mcgrath wake and whisper eurelle dark chromatic
Auxiliary Phoenix - If We Could Build,Embrace The Crisis - Lessons EP, for those i love for those i love sam wickens all ive seen daveit ferris oneirataxia dean maywood dean maywood,Auxiliary Phoenix - If We Could Build Embrace The Crisis - Lessons EP  for those i love for those i love sam wickens all ive seen daveit ferris oneirataxia dean maywood dean maywood
Greenshine - Family,Micko – Thought Process, ryan vail elma orkestra borders animal party phantom feat camilla jones daveit ferris illuminate the atmosphere daveit ferris bravery of the barfly,Greenshine - Family Micko – Thought Process  ryan vail elma orkestra borders animal party phantom feat camilla jones daveit ferris illuminate the atmosphere daveit ferris bravery of the barfly
Two Door Cinema Club - False Alarm,Clive Barnes - Haunted Head EP, moylan for the birds the lockin the lockin uly pak it in mama polytunnel time time,Two Door Cinema Club - False Alarm Clive Barnes - Haunted Head EP  moylan for the birds the lockin the lockin uly pak it in mama polytunnel time time
Revelator - Fine Lines EP,Khakikid - Pug Ugly EP, the flavours send it black bank folk last star fall cat turner situation a need for more foy vance from muscle shoals,Revelator - Fine Lines EP Khakikid - Pug Ugly EP  the flavours send it black bank folk last star fall cat turner situation a need for more foy vance from muscle shoals
Loud Motive - Back Then Right Now MixtapeJuly1/7,M. Cambridge - Sea Songs, fangclub vulture culture nerves everything ahead of us eve belle the fine line between brave and stupid pat dam smyth the last king,Loud Motive - Back Then Right Now MixtapeJuly1/7 M. Cambridge - Sea Songs  fangclub vulture culture nerves everything ahead of us eve belle the fine line between brave and stupid pat dam smyth the last king
