Artist,Title,prepText,allText
Chris Brown,Run It!, contributorsrun it lyricsproduced by scott storch intro juelz santana,Chris Brown Run It!  contributorsrun it lyricsproduced by scott storch intro juelz santana
Park Kyung,Ordinary Love, contributors보통연애 ordinary love lyrics박경 보통연애 ft 박보람 가사 verse park kyung,Park Kyung Ordinary Love  contributors보통연애 ordinary love lyrics박경 보통연애 ft 박보람 가사 verse park kyung
KARD,Oh NaNa (Hidden. HUR YOUNG JI), contributorsapril singles release calendar lyrics41 alan walker ruben heading home alan walker ruben headinghomedemo2016wav,KARD Oh NaNa (Hidden. HUR YOUNG JI)  contributorsapril singles release calendar lyrics41 alan walker ruben heading home alan walker ruben headinghomedemo2016wav
Jay Park,Me Like Yuh, contributorsme like yuh lyricsintro i need a cha cha beat boy,Jay Park Me Like Yuh  contributorsme like yuh lyricsintro i need a cha cha beat boy
Ailee,I will go to you like the first snow, contributorstranslationsfrançaisromanizationenglish첫눈처럼 너에게 가겠다 i will go to you like the first snow lyrics에일리 첫눈처럼 너에게 가겠다 가사 verse ,Ailee I will go to you like the first snow  contributorstranslationsfrançaisromanizationenglish첫눈처럼 너에게 가겠다 i will go to you like the first snow lyrics에일리 첫눈처럼 너에게 가겠다 가사 verse 
Queens of the Stone Age,No One Knows,paroles de la chanson no one knows par queens of the stone age we get some rules to follow that and this these and those,Queens of the Stone Age No One Knows paroles de la chanson no one knows par queens of the stone age we get some rules to follow that and this these and those
Sia,Chandelier,paroles de la chanson chandelier par sia party girls dont get hurt cant feel anything when will i learn,Sia Chandelier paroles de la chanson chandelier par sia party girls dont get hurt cant feel anything when will i learn
Red Hot Chili Peppers,Goodbye Angels,paroles de la chanson goodbye angels par red hot chili peppers suicide a month before i met you deep regrets i never could forget you,Red Hot Chili Peppers Goodbye Angels paroles de la chanson goodbye angels par red hot chili peppers suicide a month before i met you deep regrets i never could forget you
Red Hot Chili Peppers,Minor Thing,paroles de la chanson minor thing par red hot chili peppers i change the key from c to d you see to me its just a minor thing,Red Hot Chili Peppers Minor Thing paroles de la chanson minor thing par red hot chili peppers i change the key from c to d you see to me its just a minor thing
Lil Wayne,Rich As Fuck,paroles de la chanson rich as fuck par lil wayne never talk to the cops i dont speak pig latin i turn the penny to a motherfcking janet jackson,Lil Wayne Rich As Fuck paroles de la chanson rich as fuck par lil wayne never talk to the cops i dont speak pig latin i turn the penny to a motherfcking janet jackson
Drake,Portland,paroles de la chanson portland par drake drake murda on the beat so its not nice,Drake Portland paroles de la chanson portland par drake drake murda on the beat so its not nice
Big Sean,Light,paroles de la chanson light par big sean is it time,Big Sean Light paroles de la chanson light par big sean is it time
ScHoolboy Q,Studio,paroles de la chanson studio par schoolboy q bj the chicago kid im just sitting in the studio just trying to get to you baby,ScHoolboy Q Studio paroles de la chanson studio par schoolboy q bj the chicago kid im just sitting in the studio just trying to get to you baby
blackbear,make daddy proud, contributors​make daddy proud lyricsverse what is it with you you never sleep alone girl you wont listen to me,blackbear make daddy proud  contributors​make daddy proud lyricsverse what is it with you you never sleep alone girl you wont listen to me
Milky Chance,Stolen Dance,paroles de la chanson stolen dance par milky chance i want you by my side so that i never feel alone again,Milky Chance Stolen Dance paroles de la chanson stolen dance par milky chance i want you by my side so that i never feel alone again
"Lollapalooza - Grant Park, Chicago","Eaux Claires - Eau Claire, WI",a highly scientific reallife exploration into how anyone could possibly like j cole shea serrano fall is the worst season jia tolentino why i h8 online media carlesyou might also likeembed,"Lollapalooza - Grant Park, Chicago Eaux Claires - Eau Claire, WI a highly scientific reallife exploration into how anyone could possibly like j cole shea serrano fall is the worst season jia tolentino why i h8 online media carlesyou might also likeembed"
The Black Crowes,She Talks To Angels,paroles de la chanson she talks to angels par the black crowes she never mentions the word addiction in certain company,The Black Crowes She Talks To Angels paroles de la chanson she talks to angels par the black crowes she never mentions the word addiction in certain company
Blind Melon,No Rain, contributorsno rain lyricsintro ooh ooh ooh ooh ooh ooh,Blind Melon No Rain  contributorsno rain lyricsintro ooh ooh ooh ooh ooh ooh
Collective Soul,December,paroles de la chanson december par collective soul why drink the water from my hand contagious as you think i am,Collective Soul December paroles de la chanson december par collective soul why drink the water from my hand contagious as you think i am
Eagle-Eye Cherry,Save Tonight,paroles de la chanson save tonight par eagle eye cherry go on and close the curtains cause all we need is candle light,Eagle-Eye Cherry Save Tonight paroles de la chanson save tonight par eagle eye cherry go on and close the curtains cause all we need is candle light
The Shins,Name For You,paroles de la chanson name for you par the shins my girl if youre lucky one day rolling down the ancient high street youll find,The Shins Name For You paroles de la chanson name for you par the shins my girl if youre lucky one day rolling down the ancient high street youll find
The xx,Say Something Loving,paroles de la chanson say something loving par the xx before it slips away,The xx Say Something Loving paroles de la chanson say something loving par the xx before it slips away
Kings of Leon,Reverend,paroles de la chanson reverend par kings of leon on the limb cut down in the middle of the night caught in a trap cursed by the crown of the wandering man who was never coming back,Kings of Leon Reverend paroles de la chanson reverend par kings of leon on the limb cut down in the middle of the night caught in a trap cursed by the crown of the wandering man who was never coming back
Ne-Yo,One In A Million,paroles de la chanson one in a million par neyo jetsetter gogetter,Ne-Yo One In A Million paroles de la chanson one in a million par neyo jetsetter gogetter
Lil Pump,Crazy,paroles de la chanson crazy par lil pump yeah lil pump ooh big head on the beat,Lil Pump Crazy paroles de la chanson crazy par lil pump yeah lil pump ooh big head on the beat
Lil Pump,Iced Out (feat. 2 Chainz), contributorlil pump essentials lyrics1 illuminati with anuel aa racks on racks butterfly doors,Lil Pump Iced Out (feat. 2 Chainz)  contributorlil pump essentials lyrics1 illuminati with anuel aa racks on racks butterfly doors
Lil Pump,Flex Like Ouu,paroles de la chanson flex like ouu par lil pump ouu ouu lil pump,Lil Pump Flex Like Ouu paroles de la chanson flex like ouu par lil pump ouu ouu lil pump
6LACK,PRBLMS, contributorstranslationstürkçeprblms lyricsintro yeah yeah yeah yeah,6LACK PRBLMS  contributorstranslationstürkçeprblms lyricsintro yeah yeah yeah yeah
Saint Motel,Born Again, contributorsborn again lyricsverse well theres no need to be nervous im not dangerous anymore,Saint Motel Born Again  contributorsborn again lyricsverse well theres no need to be nervous im not dangerous anymore
Twenty One Pilots,Heathens,paroles de la chanson heathens par twenty one pilots all my friends are heathens take it slow wait for them to ask you who you know,Twenty One Pilots Heathens paroles de la chanson heathens par twenty one pilots all my friends are heathens take it slow wait for them to ask you who you know
The New Basement Tapes,When I Get My Hands On You, contributorswhen i get my hands on you lyricsverse when i set my eyes on you gonna keep you out of town at night,The New Basement Tapes When I Get My Hands On You  contributorswhen i get my hands on you lyricsverse when i set my eyes on you gonna keep you out of town at night
The New Basement Tapes,Down On The Bottom, contributorsdown on the bottom lyricsdown on the bottom down to the last drop in the cup down on the bottom,The New Basement Tapes Down On The Bottom  contributorsdown on the bottom lyricsdown on the bottom down to the last drop in the cup down on the bottom
The New Basement Tapes,Hidee Hidee Ho #11, contributorshidee hidee ho lyricshow could she reject me send me on my way how could she suspect me,The New Basement Tapes Hidee Hidee Ho #11  contributorshidee hidee ho lyricshow could she reject me send me on my way how could she suspect me
Father John Misty,Bored in the USA,paroles de la chanson bored in the usa par father john misty how many people rise and say my brains so awfully glad to be here,Father John Misty Bored in the USA paroles de la chanson bored in the usa par father john misty how many people rise and say my brains so awfully glad to be here
Tom Waits,Come On Up To The House,paroles de la chanson come on up to the house par tom waits well the moon is broken and the sky is cracked come on up to the house,Tom Waits Come On Up To The House paroles de la chanson come on up to the house par tom waits well the moon is broken and the sky is cracked come on up to the house
Future,Comin Out Strong,paroles de la chanson comin out strong par future high klassified i got the truth me baby,Future Comin Out Strong paroles de la chanson comin out strong par future high klassified i got the truth me baby
Lupe Fiasco,The Show Goes On,paroles de la chanson the show goes on par lupe fiasco alright already the show goes on alright till the morning we dream so long,Lupe Fiasco The Show Goes On paroles de la chanson the show goes on par lupe fiasco alright already the show goes on alright till the morning we dream so long
Kid Ink,F With U,paroles de la chanson f with u par kid ink kid ink lets go,Kid Ink F With U paroles de la chanson f with u par kid ink kid ink lets go
Playboi Carti,wokeuplikethis*,paroles de la chanson wokeuplikethis par playboi carti lil uzi vert know i got a lot lot,Playboi Carti wokeuplikethis* paroles de la chanson wokeuplikethis par playboi carti lil uzi vert know i got a lot lot
Young Money,Trophies, contributorspolaroid lyricszwrotka w mojej głowie mam albumy zdjęć w tamtym roku zapełniłem sobie cały łeb,Young Money Trophies  contributorspolaroid lyricszwrotka w mojej głowie mam albumy zdjęć w tamtym roku zapełniłem sobie cały łeb
Parquet Courts,Pretty Machines, contributorspretty machines lyricsah moonlight its hard to believe it and its harder to need it,Parquet Courts Pretty Machines  contributorspretty machines lyricsah moonlight its hard to believe it and its harder to need it
Parquet Courts,Insufferable, contributorsinsufferable lyricsverse resigned his ego to fall through a phone,Parquet Courts Insufferable  contributorsinsufferable lyricsverse resigned his ego to fall through a phone
Parquet Courts,Ducking And Dodging, contributorsducking dodging lyricschorus youve been ducking and dodging but you cant come home no more youve been ducking and dodging but you cant come home no more,Parquet Courts Ducking And Dodging  contributorsducking dodging lyricschorus youve been ducking and dodging but you cant come home no more youve been ducking and dodging but you cant come home no more
Crossroad Copeland - Cope Land,Aniara's Dream - Another Dimension Below, lafleur marcie à louest lynda lemay il ny a quun pas madame autruche réveillezmoi quand il fera beau maelydée sortie,Crossroad Copeland - Cope Land Aniara's Dream - Another Dimension Below  lafleur marcie à louest lynda lemay il ny a quun pas madame autruche réveillezmoi quand il fera beau maelydée sortie
Projеt Panache - Chasser le malt,P'tit Gros Bison - Les pieds dans l'vide, stanley hilaire saintmax by the beach sarkasm as empires decay augustine neither nightmares nor dreams come true david thibault désormais,Projеt Panache - Chasser le malt P'tit Gros Bison - Les pieds dans l'vide  stanley hilaire saintmax by the beach sarkasm as empires decay augustine neither nightmares nor dreams come true david thibault désormais
Mélissa Bédard - Aime-toi comme ça,Jeanne Côté - Suite pour personne, fortune cookie club diviser dans les nuances karine lagueux le soleil fait dire qutes pas rentrée dumas cosmologie david höff 40th deluxe edition,Mélissa Bédard - Aime-toi comme ça Jeanne Côté - Suite pour personne  fortune cookie club diviser dans les nuances karine lagueux le soleil fait dire qutes pas rentrée dumas cosmologie david höff 40th deluxe edition
JEANDO - Club Wagon,Jonathan Roy - Life Distorsions, jesse murray i did it all for you orchestre national de jazz de montréal miles smiles wayne shines lorraine desmarais jazz trio street beat suite mirabelle flickering lights,JEANDO - Club Wagon Jonathan Roy - Life Distorsions  jesse murray i did it all for you orchestre national de jazz de montréal miles smiles wayne shines lorraine desmarais jazz trio street beat suite mirabelle flickering lights
Hélène Perreault - À distance,Elle Lapointe - NostalgiaFévrier, roby talbot échos lili gauthier lendroit où je suis née andréanne sabourincôté mauvais plis tom folly folking tard,Hélène Perreault - À distance Elle Lapointe - NostalgiaFévrier  roby talbot échos lili gauthier lendroit où je suis née andréanne sabourincôté mauvais plis tom folly folking tard
Michel Villeneuve - La Shed au Solstice,Taco Theory - Best of Taco Theory 2022, le winston band winston express janina fialkowska chopin récital zoo baby volume solastalgie solastalgie,Michel Villeneuve - La Shed au Solstice Taco Theory - Best of Taco Theory 2022  le winston band winston express janina fialkowska chopin récital zoo baby volume solastalgie solastalgie
Rachel Therrien Latin Jazz Project - Mi Hogar,Sophia Bel - Anxious Avoidant (Deluxe), lynda lemay entre la flamme et la suie amours et patterns frank moutarde léveil curepipe javais arthur h la vie,Rachel Therrien Latin Jazz Project - Mi Hogar Sophia Bel - Anxious Avoidant (Deluxe)  lynda lemay entre la flamme et la suie amours et patterns frank moutarde léveil curepipe javais arthur h la vie
Désirée - Les souvenirs flous,Hugo Mudie - Bad Vibrations, edwin raphael warm terracotta bàrbe à pàpà ton criss de riff de marde vol migmafrica à la mémoire de nos ancêtres claudie létourneau bourrasque,Désirée - Les souvenirs flous Hugo Mudie - Bad Vibrations  edwin raphael warm terracotta bàrbe à pàpà ton criss de riff de marde vol migmafrica à la mémoire de nos ancêtres claudie létourneau bourrasque
Mélina Lequy - Si tes pensées traînent,Bye Parula - I, phonz film de répertoire samuele une paillette dans lengrenage oliver forest shouldnt be too long menoncle jason live avec la paroisse live,Mélina Lequy - Si tes pensées traînent Bye Parula - I  phonz film de répertoire samuele une paillette dans lengrenage oliver forest shouldnt be too long menoncle jason live avec la paroisse live
Jean-Michel Pilc - Symphony,Jacques Kuba Séguin - Parfum no. 1, dominique beauséjourostiguy jeanmichel dubé aux deux hémisphères old soul overgrown michel barbeau hélium patche patche,Jean-Michel Pilc - Symphony Jacques Kuba Séguin - Parfum no. 1  dominique beauséjourostiguy jeanmichel dubé aux deux hémisphères old soul overgrown michel barbeau hélium patche patche
Big Brave - Nature Morte,Ingrid St-Pierre - Reines, gabrielle shonk across the room jeannot bournival avec vue sur lamer noémie kaiser lor des fous simon lachance le chemin des pots cassés,Big Brave - Nature Morte Ingrid St-Pierre - Reines  gabrielle shonk across the room jeannot bournival avec vue sur lamer noémie kaiser lor des fous simon lachance le chemin des pots cassés
Empress - Empress,Briche - Cervidés, charles robert des fragments de lumière illuminent mon corps qui se souvient transition outremer mythological nymph jeanne ménez les contretemps nolton lake dark blue,Empress - Empress Briche - Cervidés  charles robert des fragments de lumière illuminent mon corps qui se souvient transition outremer mythological nymph jeanne ménez les contretemps nolton lake dark blue
Rémi Chassé - Phénomène phéromonalMars,Frank Williams - Astheure ça s'en vient, pourpre pourpre olivia khoury portraits mirror mirror imaginary friend laroie tragedy,Rémi Chassé - Phénomène phéromonalMars Frank Williams - Astheure ça s'en vient  pourpre pourpre olivia khoury portraits mirror mirror imaginary friend laroie tragedy
"Debate Club - Égarements, Vol. 1",Gayance - Mascarade, stephanie osorio fruta del corazon yannick nézetséguin lorchestre métropolitain sibelius greenhouse ensemble rezdechaussée marcandré pépin arômes de jazz,"Debate Club - Égarements, Vol. 1 Gayance - Mascarade  stephanie osorio fruta del corazon yannick nézetséguin lorchestre métropolitain sibelius greenhouse ensemble rezdechaussée marcandré pépin arômes de jazz"
Huriel - I,Orchestre Symphonique de Montréal - Mahler, claude lanthrope ontologie des ombres jeanmichel blais sérénades grand héron la fin est croche thierry larose sprint,Huriel - I Orchestre Symphonique de Montréal - Mahler  claude lanthrope ontologie des ombres jeanmichel blais sérénades grand héron la fin est croche thierry larose sprint
Le Vent du Nord - Les voix du vent avec cordes et piano,Alain Lefèvre - Paris Memories, siderum all phenomena are empty and selfless excavation poésie ranger lhiver jeanfrançois janvier le manège teenage witch maintenant ou jamais,Le Vent du Nord - Les voix du vent avec cordes et piano Alain Lefèvre - Paris Memories  siderum all phenomena are empty and selfless excavation poésie ranger lhiver jeanfrançois janvier le manège teenage witch maintenant ou jamais
Madiba King - Faudrait ben,Various Artists - La Voix 2023, joly deuil double date with death portraits étienne lessard tomber le monde tom chicoine moteur super sport,Madiba King - Faudrait ben Various Artists - La Voix 2023  joly deuil double date with death portraits étienne lessard tomber le monde tom chicoine moteur super sport
Cubby V - Lustrum,Anne Bisson - Be My Lover, joseph stephen retour aux sources okapi sordo blesse normal philippe tremblay premier arrêt,Cubby V - Lustrum Anne Bisson - Be My Lover  joseph stephen retour aux sources okapi sordo blesse normal philippe tremblay premier arrêt
Matt Holubowski - Like Flowers on a Molten Lawn,Keith Kouna - Métastases, n nao leau et les rêves terrible tango negative space tina leon pull banc dparc le cirque,Matt Holubowski - Like Flowers on a Molten Lawn Keith Kouna - Métastases  n nao leau et les rêves terrible tango negative space tina leon pull banc dparc le cirque
Simon Daniel - Sans titre (for now),Joseph Carré - Magique! (Deluxe Version), simon boisseau le déjeuner grand public idéal tempo rémi cormier glimpse jorgensen critical hits,Simon Daniel - Sans titre (for now) Joseph Carré - Magique! (Deluxe Version)  simon boisseau le déjeuner grand public idéal tempo rémi cormier glimpse jorgensen critical hits
Lev - Shesh-Besh,Les Gars du Nord - Les fils du père, no cosmos you iii everything else quatuor molinari lumières nordiques mirebelle mirebelle milanku à laube,Lev - Shesh-Besh Les Gars du Nord - Les fils du père  no cosmos you iii everything else quatuor molinari lumières nordiques mirebelle mirebelle milanku à laube
Super Plage - Magie à minuit,Alexandra Stréliski - Néo-Romance, philippe brach les gens quon aime marianne gavin mille lunes bluebird myrtle avenue ric wilson chromeo atrak clusterfunk,Super Plage - Magie à minuit Alexandra Stréliski - Néo-Romance  philippe brach les gens quon aime marianne gavin mille lunes bluebird myrtle avenue ric wilson chromeo atrak clusterfunk
Heïka - Good Good,Various Artists - C'est notre histoire, émilieclaire barlow spark bird festival international de la chanson de granby jamais trop tôt vol pako nanto maten utenat,Heïka - Good Good Various Artists - C'est notre histoire  émilieclaire barlow spark bird festival international de la chanson de granby jamais trop tôt vol pako nanto maten utenat
Son Cinéma - Like a Ghost Into the Fog,Murray A. Lightburn - Once Upon A Time in Montreal, mobile roadmap to redemption larche jaurais voulu rester plus longtempsavril hugo lapointe racines qc ginette reno cest tout moi,Son Cinéma - Like a Ghost Into the Fog Murray A. Lightburn - Once Upon A Time in Montreal  mobile roadmap to redemption larche jaurais voulu rester plus longtempsavril hugo lapointe racines qc ginette reno cest tout moi
Éléonore Lagacé - Elle s'en fout,Oli Laroche - Nous sommes tous des animaux, mon amie souffrance club social kanen mitshuap les lunatiques orange flottant spicer lovejoy nothing is better than everything,Éléonore Lagacé - Elle s'en fout Oli Laroche - Nous sommes tous des animaux  mon amie souffrance club social kanen mitshuap les lunatiques orange flottant spicer lovejoy nothing is better than everything
Hert Leblanc - Moi chu juste en vie,Et on déjeune - Dans l'eau, pierreluc brillant des compositions beaux lieux sur le seuil hugo bolduc sonder le sens ignominy imminent collapse,Hert Leblanc - Moi chu juste en vie Et on déjeune - Dans l'eau  pierreluc brillant des compositions beaux lieux sur le seuil hugo bolduc sonder le sens ignominy imminent collapse
Jacob Molotov - Tout le plaisir est pour moi,Chantal Campeau - Au bout du tunnel, dom gouin dom gouin sam thellend léquilibre chaloupe chaloupe joseph avalé printemps,Jacob Molotov - Tout le plaisir est pour moi Chantal Campeau - Au bout du tunnel  dom gouin dom gouin sam thellend léquilibre chaloupe chaloupe joseph avalé printemps
Frais Dispo - Teinte,Sala - Surface, marc bourdeau montréal musica antoine aspirine vacances sam krüger the songs i write in my bedroom acoustic zombie life mon cœur éclore au matin,Frais Dispo - Teinte Sala - Surface  marc bourdeau montréal musica antoine aspirine vacances sam krüger the songs i write in my bedroom acoustic zombie life mon cœur éclore au matin
Marcus Wilcour - Maison pleine et papiers peints,Bruce Liu - J.S. Bach, playfull mess another man violett pi baloney suicide hippie hourrah exposition individuelle sylvie boulianne desfois cest moi,Marcus Wilcour - Maison pleine et papiers peints Bruce Liu - J.S. Bach  playfull mess another man violett pi baloney suicide hippie hourrah exposition individuelle sylvie boulianne desfois cest moi
Roxane Reddy - Jaywalking,Hugo Blouin - Sport national, oli féra les amours chronophages auguste le bruit des saisons gaël beauchamp tu choisis pas toujours melissa pipe sextet of what remains,Roxane Reddy - Jaywalking Hugo Blouin - Sport national  oli féra les amours chronophages auguste le bruit des saisons gaël beauchamp tu choisis pas toujours melissa pipe sextet of what remains
Emmanuel Travis - DOPAMINE,Safia Nolin - Apple Music Home Session, les barocudas basta parlare trudy go solo 2frères 2frères à langlicane le husky un zoo la nuit,Emmanuel Travis - DOPAMINE Safia Nolin - Apple Music Home Session  les barocudas basta parlare trudy go solo 2frères 2frères à langlicane le husky un zoo la nuit
"Héra Ménard - Wild Flowers, Side A",Vivresse - 02022020, raphaël butler tattoo de coeur zoon bekka maiingan jessica paradis métissage braids euphoric recall,"Héra Ménard - Wild Flowers, Side A Vivresse - 02022020  raphaël butler tattoo de coeur zoon bekka maiingan jessica paradis métissage braids euphoric recall"
Lwazo Sirois & le Dernier Rodéo - Chacun pour soi,Jean-François Groulx - Myo, les voix humaines anguille sous roche blanche baillargeon le nid meghan oak dans la lune jace tu mfais brillermai,Lwazo Sirois & le Dernier Rodéo - Chacun pour soi Jean-François Groulx - Myo  les voix humaines anguille sous roche blanche baillargeon le nid meghan oak dans la lune jace tu mfais brillermai
Valery Vaughn - gris,Gabryel - Humain, dans lshed la nouvelle saison west trainz rail nomads vïc aux petits oiseaux pastel barbo microcosme,Valery Vaughn - gris Gabryel - Humain  dans lshed la nouvelle saison west trainz rail nomads vïc aux petits oiseaux pastel barbo microcosme
Livernoche - La mère du vent,Les frères Goyette - Prudence est Denise, frédéric marcotte léchange bob bissonnette live à limpérial de québec vendôme la fable de la grenouille dorée ripé le rocket scientist dalma,Livernoche - La mère du vent Les frères Goyette - Prudence est Denise  frédéric marcotte léchange bob bissonnette live à limpérial de québec vendôme la fable de la grenouille dorée ripé le rocket scientist dalma
Vvon Dogma I - The Kvlt of Glitch,They Call Me Rico - Wheel of Love, miron noir tant dartifices en écho zoe sanders femme ou fantaisie bb puma circé siluja siluja,Vvon Dogma I - The Kvlt of Glitch They Call Me Rico - Wheel of Love  miron noir tant dartifices en écho zoe sanders femme ou fantaisie bb puma circé siluja siluja
Les Chiens de Ruelle - Deux pas de plus vers nul'part,François-Félix Roy - Peines perdues, lisle ariane brunet soif kreise miraculeuse dominic dagenais la misère des riches hauterive hauterive,Les Chiens de Ruelle - Deux pas de plus vers nul'part François-Félix Roy - Peines perdues  lisle ariane brunet soif kreise miraculeuse dominic dagenais la misère des riches hauterive hauterive
