Artist,Title,prepText,allText
"A business entity that, in return for a partial ownership interest in a new company, provides investment and other assistance to the startup company’s founders to assist rapid growth.",,address or addresses an “address” is a number assigned or a numerical label given to a device connected to a computer network such devices include computer workstations laptops printers scanners etc an address is used both to identify the particular interface on the device mac “media access control” address and to specify where on the network the device is connected ip “internet protocol” address aggregator a computer program a computer application or an entity that collects and organizes a specific type of information from multiple sources and provides the results to third parties often for a fee aided and abetted a legal term that means a person either assisted in or facilitated a criminal act or was himself assisted or otherwise aided in the performance of a criminal act under federal criminal law a person who “aids abets counsels commands induces or procures” the commission of a criminal act is punishable as if he or she performed such act himself or herself see usc § archival back runs prior issues of a publication going back in time from the current issue,
"As used in this report, a business boot camp is a workshop focused on giving an individual with an entrepreneurial idea a set of skills and information that will help the individual more rapidly and successfully convert the idea into an active business.","A discussion site on the World Wide Web, comprised of distinct posts. The word “blog” is a contraction of the words “web” and “log.”",cambridge district court the district court located in cambridge district courts are massachusetts trial courts that have limited jurisdiction they preside over criminal matters with a potential sentence of up to five years imprisonment and civil matters in which the damages sought do not exceed ≈ per capita income united kingdom and other miscellaneous matters capture as used in the context of computer communications the term “capture” means to make a copy of electronic data being transferred between and among computers and networks appendix glossary captured packets data packets that have been received or recorded after or during transmission see data packets,"As used in this report, a business boot camp is a workshop focused on giving an individual with an entrepreneurial idea a set of skills and information that will help the individual more rapidly and successfully convert the idea into an active business. A discussion site on the World Wide Web, comprised of distinct posts. The word “blog” is a contraction of the words “web” and “log.” cambridge district court the district court located in cambridge district courts are massachusetts trial courts that have limited jurisdiction they preside over criminal matters with a potential sentence of up to five years imprisonment and civil matters in which the damages sought do not exceed ≈ per capita income united kingdom and other miscellaneous matters capture as used in the context of computer communications the term “capture” means to make a copy of electronic data being transferred between and among computers and networks appendix glossary captured packets data packets that have been received or recorded after or during transmission see data packets"
"An obligation imposed by law to pay money, whether in the form of compensation, punitive damages, or fees and costs, to a party, arising from injuries suffered by that party.","A civil lawsuit. That is, legal proceedings initiated by one party, the plaintiff, claiming that another party, the defendant, has violated the law in a manner that causes the defendant to be liable for injuries suffered by the plaintiff.",class c network see class a network computer crime and forensics computer crime is criminal activity committed by means of computers networks or the internet computer forensics is the detection and investigation of potential computer crimes or the use of computers in criminal activity where such investigation is conducted for the purpose of obtaining information in a manner suitable for use in a court of law computer fraud and abuse act known as “cfaa” a wideranging criminal statute that prohibits a person from engaging in various activities involving computers or networks it has both criminal and civil penalties including forfeiture provisions and its violation may result in either felony or misdemeanor punishments see usc § it this description is for internet protocol version ipv4 which is what the mit network used in and uses today,"An obligation imposed by law to pay money, whether in the form of compensation, punitive damages, or fees and costs, to a party, arising from injuries suffered by that party. A civil lawsuit. That is, legal proceedings initiated by one party, the plaintiff, claiming that another party, the defendant, has violated the law in a manner that causes the defendant to be liable for injuries suffered by the plaintiff. class c network see class a network computer crime and forensics computer crime is criminal activity committed by means of computers networks or the internet computer forensics is the detection and investigation of potential computer crimes or the use of computers in criminal activity where such investigation is conducted for the purpose of obtaining information in a manner suitable for use in a court of law computer fraud and abuse act known as “cfaa” a wideranging criminal statute that prohibits a person from engaging in various activities involving computers or networks it has both criminal and civil penalties including forfeiture provisions and its violation may result in either felony or misdemeanor punishments see usc § it this description is for internet protocol version ipv4 which is what the mit network used in and uses today"
"An appointment as a substitute with the power to act on behalf of the person who made the appointment. As used in this report, the MIT Campus Police officers were deputized to act with the power of Middlesex County Police officers near the MIT Campus.",The making of a formal request for discovery from an opposing party or a third person. See Discovery.,dhcp client id an address or identification label assigned to a device by the dhcp server dhcp server a device used to implement the dynamic host configuration protocol on a particular network appendix glossary dhcp server logs listings of requests from computers for the dhcp server to assign ip addresses these records contain mac addresses ip addresses and the date and time that the computers acknowledge the receipt of addresses,"An appointment as a substitute with the power to act on behalf of the person who made the appointment. As used in this report, the MIT Campus Police officers were deputized to act with the power of Middlesex County Police officers near the MIT Campus. The making of a formal request for discovery from an opposing party or a third person. See Discovery. dhcp client id an address or identification label assigned to a device by the dhcp server dhcp server a device used to implement the dynamic host configuration protocol on a particular network appendix glossary dhcp server logs listings of requests from computers for the dhcp server to assign ip addresses these records contain mac addresses ip addresses and the date and time that the computers acknowledge the receipt of addresses"
The act of accessing a device or website and requesting it to transmit data so that it can be viewed or stored.,"A public official who has responsibility for representing counties within the Commonwealth of Massachusetts in civil and criminal cases. The District Attorney’s Office consists of the District Attorney; prosecutors and other attorneys who work under the authority and supervision of the District Attorney, formally known as Assistant District Attorneys; and support personnel. There are 11 districts established by law in Massachusetts.",electronic communication information composed of electronic signals often but not necessarily in a digital format intended to be a communication between parties electronic message see electronic communication electronic records a digital form of data files readily able to be stored on a computer and accessed through a network,"The act of accessing a device or website and requesting it to transmit data so that it can be viewed or stored. A public official who has responsibility for representing counties within the Commonwealth of Massachusetts in civil and criminal cases. The District Attorney’s Office consists of the District Attorney; prosecutors and other attorneys who work under the authority and supervision of the District Attorney, formally known as Assistant District Attorneys; and support personnel. There are 11 districts established by law in Massachusetts. electronic communication information composed of electronic signals often but not necessarily in a digital format intended to be a communication between parties electronic message see electronic communication electronic records a digital form of data files readily able to be stored on a computer and accessed through a network"
A Hard Drive connected to a device in a manner that is external to the device.,"A witness who offers testimony in the form of an opinion based on his or her having specialized knowledge applicable to an issue in a case; this is in contrast to a fact witness, who offers testimony based on personal knowledge as to facts at issue in a case. Expert witnesses are usually paid for their time learning about the case, drafting a written report about their opinions, and giving a deposition (i.e., providing a sworn statement) or testifying at trial.",file transfer protocol a protocol used on the internet for the transfer of files from a source computer to a requesting computer foreman the member of a grand jury who presides over speaks for and signs for the grand jury usually appointed by election of the grand jury fraud a doctrine of common law whereby one person induces a second to do something or refrain from doing something as a result of false misleading or deceptive statements representations promises or conduct the goal of fraudulent conduct is usually to obtain something of value or to prevent the defrauded party from obtaining something of value see also wire fraud act free and open source software movement a movement launched in within the computer professional community the goal of which is to establish the right of all users to freely use study modify and redistribute software,"A Hard Drive connected to a device in a manner that is external to the device. A witness who offers testimony in the form of an opinion based on his or her having specialized knowledge applicable to an issue in a case; this is in contrast to a fact witness, who offers testimony based on personal knowledge as to facts at issue in a case. Expert witnesses are usually paid for their time learning about the case, drafting a written report about their opinions, and giving a deposition (i.e., providing a sworn statement) or testifying at trial. file transfer protocol a protocol used on the internet for the transfer of files from a source computer to a requesting computer foreman the member of a grand jury who presides over speaks for and signs for the grand jury usually appointed by election of the grand jury fraud a doctrine of common law whereby one person induces a second to do something or refrain from doing something as a result of false misleading or deceptive statements representations promises or conduct the goal of fraudulent conduct is usually to obtain something of value or to prevent the defrauded party from obtaining something of value see also wire fraud act free and open source software movement a movement launched in within the computer professional community the goal of which is to establish the right of all users to freely use study modify and redistribute software"
An abbreviation for gigabyte. See Gigabyte.,GLOSSARY | 170,gigabyte a unit of measurement for an amount of electronic data a byte is a unit of data consisting of bits where each bit is either or the term “giga” when used as a prefix means to the ninth power thus the term “gigabyte” means bytes grand jury an official body empaneled by a court to hear evidence of possible crimes and empowered to vote on and return indictments regarding such crimes and naming persons as defendants the grand jury is composed of citizens who meet in secret at periodic regularly scheduled sessions usually over the course of months and who hear multiple matters concerning different investigations and potential defendants in the federal system a grand jury is composed of people a quorum consists of individuals and an indictment may be returned only upon the affirmative vote of individuals a person who is facing federal felony charges has a right for those charges to be considered by a grand jury as opposed to solely by a prosecutor and can be brought to trial only upon the vote and return of an indictment by a grand jury identifying the criminal charges he or she may face at trial a grand jury may return an indictment upon a finding that probable cause exists that the person committed the offense under consideration grand jury subpoena a subpoena issued by a grand jury it may call for the production of documents or other tangible evidence or for testimony under oath of a person called before it such a subpoena has the force of an order from the court and a failure to comply with it—absent court consent—can subject the recipient to an order of contempt which may include jail time guest account as used in this report a courtesy account provided by mit libraries to persons who wish to use mit’s network and the resources available on that network but are not mit students faculty or staff,An abbreviation for gigabyte. See Gigabyte. GLOSSARY | 170 gigabyte a unit of measurement for an amount of electronic data a byte is a unit of data consisting of bits where each bit is either or the term “giga” when used as a prefix means to the ninth power thus the term “gigabyte” means bytes grand jury an official body empaneled by a court to hear evidence of possible crimes and empowered to vote on and return indictments regarding such crimes and naming persons as defendants the grand jury is composed of citizens who meet in secret at periodic regularly scheduled sessions usually over the course of months and who hear multiple matters concerning different investigations and potential defendants in the federal system a grand jury is composed of people a quorum consists of individuals and an indictment may be returned only upon the affirmative vote of individuals a person who is facing federal felony charges has a right for those charges to be considered by a grand jury as opposed to solely by a prosecutor and can be brought to trial only upon the vote and return of an indictment by a grand jury identifying the criminal charges he or she may face at trial a grand jury may return an indictment upon a finding that probable cause exists that the person committed the offense under consideration grand jury subpoena a subpoena issued by a grand jury it may call for the production of documents or other tangible evidence or for testimony under oath of a person called before it such a subpoena has the force of an order from the court and a failure to comply with it—absent court consent—can subject the recipient to an order of contempt which may include jail time guest account as used in this report a courtesy account provided by mit libraries to persons who wish to use mit’s network and the resources available on that network but are not mit students faculty or staff
"Someone who hacks. In the computer subculture, a hacker is “a person who enjoys exploring the details of programmable systems and stretching their capabilities.”3 Also used by the general public to refer to someone who exploits weaknesses in computer security.",GLOSSARY | 171,handed up in the context of a court proceeding delivered to the court such as an indictment being “handed up” to the bench after being approved by the grand jury contrast with handed down hard drive a data storage device used for storing and retrieving digital information using one or more rapidly rotating rigid discs or platters coated with a magnetic material that retains the data even when the device is turned off also known as a “hard disk drive” or an “hdd” hardware probe a physical device used to connect to an electronic device to test or otherwise investigate the content functioning operation or design of such device hexadecimal as used in the computing fields a base sixteen number or a numbering system where each digit has a value from zero to fifteen characters and instructions used in computer languages are often written in codes based on such a format,"Someone who hacks. In the computer subculture, a hacker is “a person who enjoys exploring the details of programmable systems and stretching their capabilities.”3 Also used by the general public to refer to someone who exploits weaknesses in computer security. GLOSSARY | 171 handed up in the context of a court proceeding delivered to the court such as an indictment being “handed up” to the bench after being approved by the grand jury contrast with handed down hard drive a data storage device used for storing and retrieving digital information using one or more rapidly rotating rigid discs or platters coated with a magnetic material that retains the data even when the device is turned off also known as a “hard disk drive” or an “hdd” hardware probe a physical device used to connect to an electronic device to test or otherwise investigate the content functioning operation or design of such device hexadecimal as used in the computing fields a base sixteen number or a numbering system where each digit has a value from zero to fifteen characters and instructions used in computer languages are often written in codes based on such a format"
"A range or group of IP addresses. See IP Address. The term is usually used in the context of a group of IP addresses that may be available for a particular use, or within which a particular device may be found.","“Internet Protocol Address,” which is a number that identifies and locates a device on the Internet. See Address.",latent fingerprint a fingerprint of a person normally not visible to the naked eye left on the surface of an object that has been handled by that person a latent fingerprint is the result of perspiration or other materials that emanate from the skin’s surface ridges these are detected and made visible by dusting or another process at which point they can be compared to known fingerprints on file led light emitting diode a semiconductor source of light license a legal grant by a person who controls the rights over something that permits the receiver to use or gain access to that item under circumstances where the receiver’s use or access would otherwise be unlawful log a listing or catalogue of metadata maintained by a computer or network server a typical log might identify a history of the devices a particular computer connected to when that computer was active on a network and the source and volume of data downloaded to the computer,"A range or group of IP addresses. See IP Address. The term is usually used in the context of a group of IP addresses that may be available for a particular use, or within which a particular device may be found. “Internet Protocol Address,” which is a number that identifies and locates a device on the Internet. See Address. latent fingerprint a fingerprint of a person normally not visible to the naked eye left on the surface of an object that has been handled by that person a latent fingerprint is the result of perspiration or other materials that emanate from the skin’s surface ridges these are detected and made visible by dusting or another process at which point they can be compared to known fingerprints on file led light emitting diode a semiconductor source of light license a legal grant by a person who controls the rights over something that permits the receiver to use or gain access to that item under circumstances where the receiver’s use or access would otherwise be unlawful log a listing or catalogue of metadata maintained by a computer or network server a typical log might identify a history of the devices a particular computer connected to when that computer was active on a network and the source and volume of data downloaded to the computer"
"In the federal judicial system, a judicial officer of a district court, whose authority comes from statute and not the Constitution. In criminal matters, magistrate judges often hear and decide preliminary issues, such as bail or discovery disputes, but cannot make final or conclusive rulings directly addressing the guilt or innocence of a defendant. Upon the request of a district judge, however, a magistrate judge may issue a report and recommendation on such issues, which the district judge is then free to adopt, reject, or amend as he or she decides is appropriate.","Media Access Control address, which is a unique identifier assigned to devices that can connect to a network. MAC addresses are usually assigned by the device manufacturer, but may be changed by a user.",misdemeanor a criminal offense considered less serious than a felony the penalty for conviction thereof is one year of imprisonment or less mit police the massachusetts institute of technology’s police department which consists of a chief and a varying number of police officers these are deputized by the sheriff of middlesex county to act as law enforcement officers within the area of the mit campus the mit police consists of a patrol division within which there is the crime prevention unit and a special services division within which is an investigations unit mit libraries the library system of the massachusetts institute of technology which includes the libraries of the five academic schools comprising the institute and their holdings which include over three million printed volumes over databases and electronic journals and a number of digital collections that increases yearly monitoring in the context of this report the term “monitoring” means the realtime observation of a data stream across a network,"In the federal judicial system, a judicial officer of a district court, whose authority comes from statute and not the Constitution. In criminal matters, magistrate judges often hear and decide preliminary issues, such as bail or discovery disputes, but cannot make final or conclusive rulings directly addressing the guilt or innocence of a defendant. Upon the request of a district judge, however, a magistrate judge may issue a report and recommendation on such issues, which the district judge is then free to adopt, reject, or amend as he or she decides is appropriate. Media Access Control address, which is a unique identifier assigned to devices that can connect to a network. MAC addresses are usually assigned by the device manufacturer, but may be changed by a user. misdemeanor a criminal offense considered less serious than a felony the penalty for conviction thereof is one year of imprisonment or less mit police the massachusetts institute of technology’s police department which consists of a chief and a varying number of police officers these are deputized by the sheriff of middlesex county to act as law enforcement officers within the area of the mit campus the mit police consists of a patrol division within which there is the crime prevention unit and a special services division within which is an investigations unit mit libraries the library system of the massachusetts institute of technology which includes the libraries of the five academic schools comprising the institute and their holdings which include over three million printed volumes over databases and electronic journals and a number of digital collections that increases yearly monitoring in the context of this report the term “monitoring” means the realtime observation of a data stream across a network"
