Artist,Title,prepText,allText
Caetano Veloso (1968) | August 24th,Roman Candle (1994) | August 23rd,smashing pumpkins siamese dream august 26th brian eno ambient music for airports august 27th blondie blondie august 28th kanye west donda august 29th,Caetano Veloso (1968) | August 24th Roman Candle (1994) | August 23rd smashing pumpkins siamese dream august 26th brian eno ambient music for airports august 27th blondie blondie august 28th kanye west donda august 29th
Mesopotamia (1982) | September 7th,NRG 105 (2020) | September 6th,neutral milk hotel on avery island september 9th william basinski the disintegration loops ii september 10th william basinski the disintegration loops iii september 11th william basinski the disintegration loops iv september 12th,Mesopotamia (1982) | September 7th NRG 105 (2020) | September 6th neutral milk hotel on avery island september 9th william basinski the disintegration loops ii september 10th william basinski the disintegration loops iii september 11th william basinski the disintegration loops iv september 12th
Reckoning [Deluxe Edition] (2009) | September 15th,Pinkerton [Deluxe Edition] (2010) | September 14th,spiritbox eternal blue september 17th nick drake five leaves left september 18th the meters lookka py py september 19th miles davis the complete birth of the cool september 20th,Reckoning [Deluxe Edition] (2009) | September 15th Pinkerton [Deluxe Edition] (2010) | September 14th spiritbox eternal blue september 17th nick drake five leaves left september 18th the meters lookka py py september 19th miles davis the complete birth of the cool september 20th
Suicide (1977) | September 23rd,You Won't Get What You Want (2018) | September 22nd,tony molina dissed and dismissed september 25th teen suicide i will be my own hell because there is a devil inside my body september 26th yoko ono the plastic ono band yoko ono the plastic ono band september 27th duster stratosphere september 28th,Suicide (1977) | September 23rd You Won't Get What You Want (2018) | September 22nd tony molina dissed and dismissed september 25th teen suicide i will be my own hell because there is a devil inside my body september 26th yoko ono the plastic ono band yoko ono the plastic ono band september 27th duster stratosphere september 28th
The Portable Galaxie 500 (1998) | October 5th,DIAMOND EYES (2010) | October 4th,olivia rodrigo sour october 7th starry cat starry cat october 8th the notorious big ready to die october 10th rundmc raising hell october 11th,The Portable Galaxie 500 (1998) | October 5th DIAMOND EYES (2010) | October 4th olivia rodrigo sour october 7th starry cat starry cat october 8th the notorious big ready to die october 10th rundmc raising hell october 11th
Enema of the State (1999) | October 16th,154 (1979) | October 14th, gecs gec october 18th tv girl who really cares october 19th teen suicide waste yrself october 20th21st low i could live in hope october 22nd,Enema of the State (1999) | October 16th 154 (1979) | October 14th  gecs gec october 18th tv girl who really cares october 19th teen suicide waste yrself october 20th21st low i could live in hope october 22nd
THE WHITE BIRCH (1994) | October 25th,contemporary movement (2000) | October 24th,megan thee stallion good news october 27th joyce manor never hungover again october 30th new order lowlife collectors edition october 31st,THE WHITE BIRCH (1994) | October 25th contemporary movement (2000) | October 24th megan thee stallion good news october 27th joyce manor never hungover again october 30th new order lowlife collectors edition october 31st
DAMN. (2017) | November 9th,4,the police every breath you take the classics november 11th quadeca from me to you november 13th silk sonic an evening with silk sonic november 14th zillakami dogboy november 20th,DAMN. (2017) | November 9th 4 the police every breath you take the classics november 11th quadeca from me to you november 13th silk sonic an evening with silk sonic november 14th zillakami dogboy november 20th
BUILDING NOTHING OUT OF SOMETHING (1999) | December 11th,Skylarking (1986) | December 9th,bauhaus mask december 13th slint spiderland remastered december 14th sales sales lp december 16th playboi carti die lit december 18th,BUILDING NOTHING OUT OF SOMETHING (1999) | December 11th Skylarking (1986) | December 9th bauhaus mask december 13th slint spiderland remastered december 14th sales sales lp december 16th playboi carti die lit december 18th
…presenting the fabulous RONETTES featuring VERONICA (1964) | December 22nd,Zenyatta Mondatta (1980) | December 21st,john coltrane the olatunji concert the last live recording december 27th otis redding the dock of the bay december 30th1embed,…presenting the fabulous RONETTES featuring VERONICA (1964) | December 22nd Zenyatta Mondatta (1980) | December 21st john coltrane the olatunji concert the last live recording december 27th otis redding the dock of the bay december 30th1embed
The Beatles,Golden Slumbers - Remastered, contributorssignifying rappers lyricsthe schools in a portion of boston stretching from just south of south boston through roxbury and into dorchester are districted with a similar effect the predominantly black areas are cut away from the predominantly white areas morgan v hennigan us district court for massachusetts ,The Beatles Golden Slumbers - Remastered  contributorssignifying rappers lyricsthe schools in a portion of boston stretching from just south of south boston through roxbury and into dorchester are districted with a similar effect the predominantly black areas are cut away from the predominantly white areas morgan v hennigan us district court for massachusetts 
The Beatles,Oh! Darling - Remastered, contributor2018 haywoodindahood listening log lyricslast updated 516pm mstoctoberoctober 6jesse powell — jesse powell 1996october 5girl in red — chapter blanca — shattered lougotcash feat trippie redd — too turnt 2018october 4terri clark — raising the bar ,The Beatles Oh! Darling - Remastered  contributor2018 haywoodindahood listening log lyricslast updated 516pm mstoctoberoctober 6jesse powell — jesse powell 1996october 5girl in red — chapter blanca — shattered lougotcash feat trippie redd — too turnt 2018october 4terri clark — raising the bar 
One Direction,Girl Almighty,paroles de la chanson girl almighty par one direction hey hey oh no no no,One Direction Girl Almighty paroles de la chanson girl almighty par one direction hey hey oh no no no
One Direction,No Control,paroles de la chanson no control par one direction stained coffee cup just that fingerprinted lipstick’s not enough,One Direction No Control paroles de la chanson no control par one direction stained coffee cup just that fingerprinted lipstick’s not enough
Arctic Monkeys,Love is a Laserquest,paroles de la chanson love is a laserquest par arctic monkeys do you still feel younger than you thought you would by now or darling have you started feeling old yet,Arctic Monkeys Love is a Laserquest paroles de la chanson love is a laserquest par arctic monkeys do you still feel younger than you thought you would by now or darling have you started feeling old yet
One Direction,Change My Mind, contributorschange my mind lyricsverse louis the end of the night we should say goodbye but we carry on while everyones gone,One Direction Change My Mind  contributorschange my mind lyricsverse louis the end of the night we should say goodbye but we carry on while everyones gone
Eminem,The Monster,paroles de la chanson the monster par eminem rihanna im friends with the monster thats under my bed,Eminem The Monster paroles de la chanson the monster par eminem rihanna im friends with the monster thats under my bed
The Black Eyed Peas,Imma Be, contributorsdats my life lyricsprod drumma boy verse ,The Black Eyed Peas Imma Be  contributorsdats my life lyricsprod drumma boy verse 
Forty Foot Echo,Brand New Day, contributorsbrand new day lyricsnever thought id say im sorry never thought id be the one to bring you down now when i look out my window,Forty Foot Echo Brand New Day  contributorsbrand new day lyricsnever thought id say im sorry never thought id be the one to bring you down now when i look out my window
Eminem,Love The Way You Lie,paroles de la chanson love the way you lie par eminem rihanna just gonna stand there and watch me burn,Eminem Love The Way You Lie paroles de la chanson love the way you lie par eminem rihanna just gonna stand there and watch me burn
Childish Gambino,Hold You Down,paroles de la chanson hold you down par childish gambino oh i want it yeah whenever you need my hand,Childish Gambino Hold You Down paroles de la chanson hold you down par childish gambino oh i want it yeah whenever you need my hand
Macklemore & Ryan Lewis,Same Love - feat. Mary Lambert, contributorstranslationsfrançaissame love lyricspiano intro verse macklemore when i was in the third grade i thought that i was gay,Macklemore & Ryan Lewis Same Love - feat. Mary Lambert  contributorstranslationsfrançaissame love lyricspiano intro verse macklemore when i was in the third grade i thought that i was gay
M83,Raconte-Moi Une Histoire, contributorsracontemoi une histoire lyricsmonologue zelly meldaljohnsen i heard about this frog its a very tiny frog,M83 Raconte-Moi Une Histoire  contributorsracontemoi une histoire lyricsmonologue zelly meldaljohnsen i heard about this frog its a very tiny frog
Childish Gambino,II. earth, contributorsii earth the oldest computer the last night lyricschorus childish gambino see now i dont wanna see an era an era an era see now i just wanna live forever and ever,Childish Gambino II. earth  contributorsii earth the oldest computer the last night lyricschorus childish gambino see now i dont wanna see an era an era an era see now i just wanna live forever and ever
Alexi Murdoch,Song For You, contributorssong for you lyricsverse so today i wrote a song for you cause a day can get so long,Alexi Murdoch Song For You  contributorssong for you lyricsverse so today i wrote a song for you cause a day can get so long
Damien Jurado,Sheets, contributorssheets lyricsis he still coming around like an injured bird needing a nest a place to rest his head in a song youll regret still you take him lord knows i dont wanna compete,Damien Jurado Sheets  contributorssheets lyricsis he still coming around like an injured bird needing a nest a place to rest his head in a song youll regret still you take him lord knows i dont wanna compete
Gregory Alan Isakov,That Moon Song, contributorsthat moon song lyricsthe tail lights burn red they were hotter than hell and ive been long gone couldnt you tell,Gregory Alan Isakov That Moon Song  contributorsthat moon song lyricsthe tail lights burn red they were hotter than hell and ive been long gone couldnt you tell
The Morning Benders,Excuses, contributorsexcuses lyricsyou tried to taste me and i taped my tongue to the southern tip of your body our bones are too heavy to come up,The Morning Benders Excuses  contributorsexcuses lyricsyou tried to taste me and i taped my tongue to the southern tip of your body our bones are too heavy to come up
KMFDM,Superhero, contributorssuperhero lyricsyoure so wonderful apple of everyones eye youre so clever,KMFDM Superhero  contributorssuperhero lyricsyoure so wonderful apple of everyones eye youre so clever
The Presets,Talk Like That,paroles de la chanson talk like that par the presets oh oh oh oh,The Presets Talk Like That paroles de la chanson talk like that par the presets oh oh oh oh
Norah Jones,Sunrise,paroles de la chanson sunrise par norah jones sunrise sunrise looks like mornin in your eyes,Norah Jones Sunrise paroles de la chanson sunrise par norah jones sunrise sunrise looks like mornin in your eyes
Ray Charles,You Don't Know Me, contributorsyou don’t know me lyricsintro you dont love me you dont know me,Ray Charles You Don't Know Me  contributorsyou don’t know me lyricsintro you dont love me you dont know me
Youngblood Hawke,We Come Running,paroles de la chanson we come running par youngblood hawke we come running we come running,Youngblood Hawke We Come Running paroles de la chanson we come running par youngblood hawke we come running we come running
Avicii,The Nights,paroles de la chanson the nights par avicii hey once upon a younger year when all our shadows disappeared,Avicii The Nights paroles de la chanson the nights par avicii hey once upon a younger year when all our shadows disappeared
MGMT,Kids,paroles de la chanson kids par mgmt you were a child crawling on your knees toward him,MGMT Kids paroles de la chanson kids par mgmt you were a child crawling on your knees toward him
Jack Ü,Where Are Ü Now (with Justin Bieber),paroles de la chanson where are u now par jack u i gave you the key when the door wasnt open just admit it see i gave you faith and you doubt and it opened cant deny it,Jack Ü Where Are Ü Now (with Justin Bieber) paroles de la chanson where are u now par jack u i gave you the key when the door wasnt open just admit it see i gave you faith and you doubt and it opened cant deny it
Katy Perry,Part Of Me,paroles de la chanson part of me par katy perry days like this i want to drive away pack my bags and watch your shadow fade,Katy Perry Part Of Me paroles de la chanson part of me par katy perry days like this i want to drive away pack my bags and watch your shadow fade
Ellie Goulding,On My Mind,paroles de la chanson on my mind par ellie goulding its a little dirty how the whole thing started i dont even really know what you intended,Ellie Goulding On My Mind paroles de la chanson on my mind par ellie goulding its a little dirty how the whole thing started i dont even really know what you intended
Bastille,Pompeii,paroles de la chanson pompeii par bastille i was left to my own devices many days fell away with nothing to show,Bastille Pompeii paroles de la chanson pompeii par bastille i was left to my own devices many days fell away with nothing to show
American Authors,Best Day Of My Life,paroles de la chanson best day of my life par american authors i had a dream so big and loud i jumped so high i touched the clouds,American Authors Best Day Of My Life paroles de la chanson best day of my life par american authors i had a dream so big and loud i jumped so high i touched the clouds
"Good album, was worth the listen (212)",Decent album (388),❤️ stier album i can have it on repeat should listen 💎 goatesque ive had it on repeat must listen 5listen later httpsopenspotifycomalbum30lgwjklky1tox7edigylqsitqsi3pjvr1cpzjerhnlskw discographies william kekra jhené aiko muse michael jackson eason chan spacetime continuum brennan savage pepe rou alkpote giveon lana del rey bts laurent voulzy aminé bruno mars aether georgio fra alcest cigarettes after sex the game madvillain nas mobb deep suprême ntm daft punk booba frank ocean jayz kanye west prince willow jaden usher yoko shimomura travis scott aerosmith radiohead coldplay andrea bocelli bryson tiller chopmonk chynna zuukou mayzie enrico intra jokair wuf les rallizes dénudés laylow supper moment dear jane thahomey playboi carti anderson paak xavier dang beeby népal yameii online isaiah rashad ak3k black eyes peas emune borealism little big 6ix9ine 6lack björk snoop dogg nirvana кино foxxy dekay danny brown griff fka twigs death grips kendrick lamar killa fonic earl sweatshirt lingua ignota xiu xiu the caretaker the carebear lady gaga jimi hendrix led zeppelin ray charles iron maiden franz zappa repulsive black atlass rihanna gorillaz oneohtrix point never mac miller yves tumor tame impala godspeed you black emperor sch jack stauber machine girl goreshit aphex twin laura pausini starmoon acidgvrl mabisyo jayz listened already,"Good album, was worth the listen (212) Decent album (388) ❤️ stier album i can have it on repeat should listen 💎 goatesque ive had it on repeat must listen 5listen later httpsopenspotifycomalbum30lgwjklky1tox7edigylqsitqsi3pjvr1cpzjerhnlskw discographies william kekra jhené aiko muse michael jackson eason chan spacetime continuum brennan savage pepe rou alkpote giveon lana del rey bts laurent voulzy aminé bruno mars aether georgio fra alcest cigarettes after sex the game madvillain nas mobb deep suprême ntm daft punk booba frank ocean jayz kanye west prince willow jaden usher yoko shimomura travis scott aerosmith radiohead coldplay andrea bocelli bryson tiller chopmonk chynna zuukou mayzie enrico intra jokair wuf les rallizes dénudés laylow supper moment dear jane thahomey playboi carti anderson paak xavier dang beeby népal yameii online isaiah rashad ak3k black eyes peas emune borealism little big 6ix9ine 6lack björk snoop dogg nirvana кино foxxy dekay danny brown griff fka twigs death grips kendrick lamar killa fonic earl sweatshirt lingua ignota xiu xiu the caretaker the carebear lady gaga jimi hendrix led zeppelin ray charles iron maiden franz zappa repulsive black atlass rihanna gorillaz oneohtrix point never mac miller yves tumor tame impala godspeed you black emperor sch jack stauber machine girl goreshit aphex twin laura pausini starmoon acidgvrl mabisyo jayz listened already"
Spring Season (1989-1990),Fall Season (1989-1990),💜 uicideboy ying yang tapes winter season 🧡 uicideboy germ dirtiestnastiestuicide 🧡 uicideboy shakewell shameless uicide 💜 surrenderdorothy breathingexercise,Spring Season (1989-1990) Fall Season (1989-1990) 💜 uicideboy ying yang tapes winter season 🧡 uicideboy germ dirtiestnastiestuicide 🧡 uicideboy shakewell shameless uicide 💜 surrenderdorothy breathingexercise
Zedd,Stay The Night - Featuring Hayley Williams Of Paramore, contributorsstay the night lyricsverse i know that we are upside down so hold your tongue and hear me out,Zedd Stay The Night - Featuring Hayley Williams Of Paramore  contributorsstay the night lyricsverse i know that we are upside down so hold your tongue and hear me out
Coldplay,Every Teardrop Is a Waterfall,paroles de la chanson every teardrop is a waterfall par coldplay i turn the music up i got my records on i shut the world outside until the lights come on,Coldplay Every Teardrop Is a Waterfall paroles de la chanson every teardrop is a waterfall par coldplay i turn the music up i got my records on i shut the world outside until the lights come on
OMI,Cheerleader - Felix Jaehn Remix Radio Edit, contributorscheerleader felix jaehn remix radio edit lyricswhen i need motivation my one solution is my queen cause she stay strong yeah yeah,OMI Cheerleader - Felix Jaehn Remix Radio Edit  contributorscheerleader felix jaehn remix radio edit lyricswhen i need motivation my one solution is my queen cause she stay strong yeah yeah
Once Jameson,Honey Im Good, contributorsgood heart lyricsverse i got money problems which lead to drinking problems,Once Jameson Honey Im Good  contributorsgood heart lyricsverse i got money problems which lead to drinking problems
Jack Ü,Where Are Ü Now (with Justin Bieber),paroles de la chanson where are u now par jack u i gave you the key when the door wasnt open just admit it see i gave you faith and you doubt and it opened cant deny it,Jack Ü Where Are Ü Now (with Justin Bieber) paroles de la chanson where are u now par jack u i gave you the key when the door wasnt open just admit it see i gave you faith and you doubt and it opened cant deny it
Ed Sheeran,All Of The Stars,paroles de la chanson all of the stars par ed sheeran its just another night and im staring at the moon i saw a shooting star and thought of you,Ed Sheeran All Of The Stars paroles de la chanson all of the stars par ed sheeran its just another night and im staring at the moon i saw a shooting star and thought of you
Neil Halstead,Digging Shelters, contributordigging shelters lyricscomputer whats the point in this you do all the thinking where are we just digging shelters in the snow,Neil Halstead Digging Shelters  contributordigging shelters lyricscomputer whats the point in this you do all the thinking where are we just digging shelters in the snow
Mel Waiters,Throw Back Days, contributorsain’t care about me lyricsintro they ain’t care bout me,Mel Waiters Throw Back Days  contributorsain’t care about me lyricsintro they ain’t care bout me
Latimore,Let's Straighten It Out, contributorslet’s straighten it out lyricssit yourself down girl and talk to me and tell me whats on your mind,Latimore Let's Straighten It Out  contributorslet’s straighten it out lyricssit yourself down girl and talk to me and tell me whats on your mind
Johnnie Taylor,Last Two Dollars, contributorslast two dollars lyricsintro whoouh what a shame,Johnnie Taylor Last Two Dollars  contributorslast two dollars lyricsintro whoouh what a shame
Johnnie Taylor,We're Getting Careless With Our Love, contributorswe’re getting careless with our love lyricsverse wake up little darling its time to go home,Johnnie Taylor We're Getting Careless With Our Love  contributorswe’re getting careless with our love lyricsverse wake up little darling its time to go home
"I'm not gon' hold you, Drugz (drugs)",come Scrabble me,i dare dare you try and school me its gon be over drugz drugs i mean you may be a blood but negroyou aint no thug i seen you gettin cracked in the street so bad geechi gotti proved trees was a gateway drugz drugs,"I'm not gon' hold you, Drugz (drugs) come Scrabble me i dare dare you try and school me its gon be over drugz drugs i mean you may be a blood but negroyou aint no thug i seen you gettin cracked in the street so bad geechi gotti proved trees was a gateway drugz drugs"
Future,Mask Off - Remix, contributorsmask off remix lyricsintro future call it how it is hendrix,Future Mask Off - Remix  contributorsmask off remix lyricsintro future call it how it is hendrix
channel ORANGE (2012) | January 1st,Wild Heart (2013) | January 1st,acid ghost vacation ii january 2nd acid ghost warhol january 2nd salvia palth melanchole january 2nd sonic youth goo january 2nd,channel ORANGE (2012) | January 1st Wild Heart (2013) | January 1st acid ghost vacation ii january 2nd acid ghost warhol january 2nd salvia palth melanchole january 2nd sonic youth goo january 2nd
Doolittle (1989) | January 2nd,Double Nickels on the Dime (1984) | January 2nd,the cars the cars january 2nd gang of four entertainment january 2nd funkadelic maggot brain january 3rd the rolling stones sticky fingеrs january 3rd,Doolittle (1989) | January 2nd Double Nickels on the Dime (1984) | January 2nd the cars the cars january 2nd gang of four entertainment january 2nd funkadelic maggot brain january 3rd the rolling stones sticky fingеrs january 3rd
CARE FOR ME (2018) | January 3rd,Purple Rain (1984) | January 3rd,kid cudi man on the moon the end of day january 3rd freddie gibbs madlib piñata january 3rd kanye west the college dropout january 3rd d’angelo voodoo january 3rd,CARE FOR ME (2018) | January 3rd Purple Rain (1984) | January 3rd kid cudi man on the moon the end of day january 3rd freddie gibbs madlib piñata january 3rd kanye west the college dropout january 3rd d’angelo voodoo january 3rd
A Love Supreme (1965) | January 4th,Seventeen Seconds (1980) | January 3rd->4th,lou reed coney island baby january 4th joy division closer january 4th the beach boys pet sounds january 5th kanye west ye january 6th,A Love Supreme (1965) | January 4th Seventeen Seconds (1980) | January 3rd->4th lou reed coney island baby january 4th joy division closer january 4th the beach boys pet sounds january 5th kanye west ye january 6th
Weezer (1994) | January 7th,Street Hassle (1978) | January 7th,tommy james the shondells crimson clover january 7th the doors the doors january 7th david bowie the rise fall of ziggy stardust and the spiders from mars january 7th talking heads fear of music january 7th,Weezer (1994) | January 7th Street Hassle (1978) | January 7th tommy james the shondells crimson clover january 7th the doors the doors january 7th david bowie the rise fall of ziggy stardust and the spiders from mars january 7th talking heads fear of music january 7th
melanchole (remaster) (2016) | January 8th,"good kid, m.A.A.d city (2012) | January 8th",juice wrld goodbye good riddance january 10th yxngxr1 childhood dreams january 11th kanye west yeezus january 11th xxxtentacion january 11th,"melanchole (remaster) (2016) | January 8th good kid, m.A.A.d city (2012) | January 8th juice wrld goodbye good riddance january 10th yxngxr1 childhood dreams january 11th kanye west yeezus january 11th xxxtentacion january 11th"
ASTROWORLD (2018) | January 12th,Pastel Blues (1965) | January 11th,13th floor elevators the psychedelic sounds of the 13th floor elevators january 12th the beatles a hard days night us soundtrack january 12th kanye west graduation january 13th tyler the creator cherry bomb january 13th,ASTROWORLD (2018) | January 12th Pastel Blues (1965) | January 11th 13th floor elevators the psychedelic sounds of the 13th floor elevators january 12th the beatles a hard days night us soundtrack january 12th kanye west graduation january 13th tyler the creator cherry bomb january 13th
"For Emma, Forever Ago (2008) | January 15th",CTRL (2017) | January 14th,the smiths the queen is dead january 15th xxxtentacion january 15th rex orange county pony january 15th the beatles help uk january 15th,"For Emma, Forever Ago (2008) | January 15th CTRL (2017) | January 14th the smiths the queen is dead january 15th xxxtentacion january 15th rex orange county pony january 15th the beatles help uk january 15th"
